<?xml version="1.0" encoding="UTF-8" standalone="yes"?>
<ns2:biblio xmlns:ns2="http://pad.polito.it/dp2/biblio"
			xmlns:xsi="http://www.w3.org/2001/XMLSchema-instance"
            xsi:schemaLocation="http://pad.polito.it/dp2/biblio biblio_e.xsd ">
    <items>
        <book isbn="1548651354" year="2009Z" id="2">
            <author>Frank Turing</author>
            <title>Story of an Automata</title>
            <citedBy>2</citedBy>
            <publisher>Best World Editor</publisher>
        </book>
        <article journal="1120-4000" issue="3" id="0">
            <author>Walter White</author>
            <title>Impact of chemistry on smart drugs</title>
            <citedBy>2</citedBy>
        </article>
        <article journal="1120-4563" issue="14" id="1">
            <author>Albert Heisenberg</author>
            <title>Machine Learning on an ARM processor</title>
            <citedBy>2</citedBy>
        </article>
    </items>
    <journals>
        <journal issn="1120-4563">
            <title>Machine Learning and Articial Intelligence News</title>
            <publisher>RCS MediaGroup</publisher>
            <issue id="4" year="1999Z" number="3"/>
            <issue id="5" year="1999Z" number="8"/>
            <issue id="6" year="1999Z" number="1"/>
            <issue id="7" year="1999Z" number="2"/>
            <issue id="8" year="1999Z" number="7"/>
            <issue id="9" year="1999Z" number="6"/>
            <issue id="10" year="1999Z" number="4"/>
            <issue id="11" year="1999Z" number="5"/>
            <issue id="12" year="1999Z" number="9"/>
            <issue id="13" year="1999Z" number="10"/>
            <issue id="14" year="1999Z" number="11"/>
            <issue id="15" year="1999Z" number="12"/>
        </journal>
        <journal issn="1120-4000">
            <title>Modern Chemistry</title>
            <publisher>Best World Editor</publisher>
            <issue id="0" year="2005Z" number="4"/>
            <issue id="1" year="2005Z" number="3"/>
            <issue id="2" year="2005Z" number="2"/>
            <issue id="3" year="2005Z" number="1"/>
        </journal>
    </journals>
</ns2:biblio>
